{
  "attempt_id": "attempt_001",
  "integrity_passed": true,
  "lineage_equal_pool_score_ci95_low": 0.0,
  "lineage_equal_pool_score_rate": 0.0,
  "overall_passed": false,
  "paired_uplift_ci95_low": -0.6857321428571429,
  "paired_uplift_rate": -0.6571428571428573,
  "primary_anchor_pure_win_rate": 0.0,
  "schema": "kaggriculture-v15-score-only-feedback-v1",
  "secondary_anchor_pure_win_rate": 0.0
}
